{
  "card_id": "card-cm-01",
  "brief_id": "brief-green-tea-gift-20260812",
  "title": "青绿新中轴",
  "one_liner": "以「青绿」做现代色锤，中式结构去仿古，一眼茶、二眼礼。",
  "advantage": "礼赠体面但不土；电商主图有色识别。",
  "differentiation": "对比金红仿古茶礼与过度极简白盒，走出可记忆的中式现代。",
  "recommended_style_buckets": [
    "chinese_modern",
    "craft_material"
  ],
  "reference_montage": [
    {
      "item_id": "packagingoftheworld:you-ming-tang-tea-gift-box",
      "why": "支撑「中式现代」方向的造型/气质参考",
      "wall": "primary"
    },
    {
      "item_id": "packagingoftheworld:genmai-soup-gift-box",
      "why": "支撑「中式现代」方向的造型/气质参考",
      "wall": "primary"
    }
  ],
  "verbal_directions": [
    "主视觉围绕「青绿新中轴」展开",
    "品名层级大于品牌纹样",
    "礼盒外侧克制，内侧给开箱惊喜"
  ],
  "sketch_directions": [
    "外盒色块构成草图",
    "开箱分层结构示意"
  ],
  "demo_prompt": "Premium Chinese green tea gift box packaging, direction \"青绿新中轴\", style 中式现代, 工艺材质感, modern not antique, elegant unboxing, studio product photography, high-end FMCG packaging mockup, not a final artwork",
  "demo_disclaimer": "Demo only — 非完稿，供侯总遴选方向",
  "hou_decision": "pending",
  "merge_into": null,
  "created_at": "2026-08-12T11:58:34Z"
}