[
  {
    "card_id": "card-cm-01",
    "brief_id": "brief-green-tea-gift-20260812",
    "title": "青绿新中轴",
    "one_liner": "以「青绿」做现代色锤，中式结构去仿古，一眼茶、二眼礼。",
    "advantage": "礼赠体面但不土；电商主图有色识别。",
    "differentiation": "对比金红仿古茶礼与过度极简白盒，走出可记忆的中式现代。",
    "recommended_style_buckets": [
      "chinese_modern",
      "craft_material"
    ],
    "reference_montage": [
      {
        "item_id": "packagingoftheworld:you-ming-tang-tea-gift-box",
        "why": "支撑「中式现代」方向的造型/气质参考",
        "wall": "primary"
      },
      {
        "item_id": "packagingoftheworld:genmai-soup-gift-box",
        "why": "支撑「中式现代」方向的造型/气质参考",
        "wall": "primary"
      }
    ],
    "verbal_directions": [
      "主视觉围绕「青绿新中轴」展开",
      "品名层级大于品牌纹样",
      "礼盒外侧克制，内侧给开箱惊喜"
    ],
    "sketch_directions": [
      "外盒色块构成草图",
      "开箱分层结构示意"
    ],
    "demo_prompt": "Premium Chinese green tea gift box packaging, direction \"青绿新中轴\", style 中式现代, 工艺材质感, modern not antique, elegant unboxing, studio product photography, high-end FMCG packaging mockup, not a final artwork",
    "demo_disclaimer": "Demo only — 非完稿，供侯总遴选方向",
    "hou_decision": "pending",
    "merge_into": null,
    "created_at": "2026-08-12T11:58:34Z"
  },
  {
    "card_id": "card-gm-02",
    "brief_id": "brief-green-tea-gift-20260812",
    "title": "静奢留白",
    "one_liner": "国际简约骨架 + 一点点东方材质，把礼盒做成「安静的贵」。",
    "advantage": "新中产审美友好，跨礼赠/自用。",
    "differentiation": "拉开国内喜庆模板；用留白和材质对抗信息噪音。",
    "recommended_style_buckets": [
      "global_minimal",
      "minimal_white"
    ],
    "reference_montage": [
      {
        "item_id": "packagingoftheworld:genmai-soup-gift-box",
        "why": "支撑「国际简约」方向的造型/气质参考",
        "wall": "primary"
      },
      {
        "item_id": "behance:search-tea-ology",
        "why": "支撑「国际简约」方向的造型/气质参考",
        "wall": "primary"
      }
    ],
    "verbal_directions": [
      "主视觉围绕「静奢留白」展开",
      "品名层级大于品牌纹样",
      "礼盒外侧克制，内侧给开箱惊喜"
    ],
    "sketch_directions": [
      "外盒色块构成草图",
      "开箱分层结构示意"
    ],
    "demo_prompt": "Premium Chinese green tea gift box packaging, direction \"静奢留白\", style 国际简约, 极简白盒, modern not antique, elegant unboxing, studio product photography, high-end FMCG packaging mockup, not a final artwork",
    "demo_disclaimer": "Demo only — 非完稿，供侯总遴选方向",
    "hou_decision": "pending",
    "merge_into": null,
    "created_at": "2026-08-12T11:58:34Z"
  },
  {
    "card_id": "card-cc-03",
    "brief_id": "brief-green-tea-gift-20260812",
    "title": "开箱仪式",
    "one_liner": "礼赠仪式感做在结构开箱，而不是贴金箔龙凤。",
    "advantage": "开箱视频/详情页天然内容点。",
    "differentiation": "仪式感来自层次与触感，而非符号堆砌。",
    "recommended_style_buckets": [
      "chinese_ceremonial",
      "regional_culture"
    ],
    "reference_montage": [
      {
        "item_id": "packagingoftheworld:you-ming-tang-tea-gift-box",
        "why": "支撑「中式典雅/礼赠」方向的造型/气质参考",
        "wall": "primary"
      },
      {
        "item_id": "packagingoftheworld:barg-tea-uzbekistan",
        "why": "支撑「中式典雅/礼赠」方向的造型/气质参考",
        "wall": "primary"
      }
    ],
    "verbal_directions": [
      "主视觉围绕「开箱仪式」展开",
      "品名层级大于品牌纹样",
      "礼盒外侧克制，内侧给开箱惊喜"
    ],
    "sketch_directions": [
      "外盒色块构成草图",
      "开箱分层结构示意"
    ],
    "demo_prompt": "Premium Chinese green tea gift box packaging, direction \"开箱仪式\", style 中式典雅/礼赠, 地域文旅, modern not antique, elegant unboxing, studio product photography, high-end FMCG packaging mockup, not a final artwork",
    "demo_disclaimer": "Demo only — 非完稿，供侯总遴选方向",
    "hou_decision": "pending",
    "merge_into": null,
    "created_at": "2026-08-12T11:58:34Z"
  }
]